{
  "version": "1.0",
  "status": "draft",
  "updated": "2026-06-15",
  "description": "Controlled vocabularies for the Sacrifice Law Workbench annotation and analysis pipeline.",
  "source_domains": [
    { "id": "body", "label": "body", "scope_note": "Human or collective body, including parts, integrity, injury, and embodiment." },
    { "id": "disease", "label": "disease", "scope_note": "Illness, pathology, contagion, corruption, or medicalized threat." },
    { "id": "wound_injury", "label": "wound / injury", "scope_note": "Damage, cutting, hurt, blood, scars, and bodily harm." },
    { "id": "medicine_healing", "label": "medicine / healing", "scope_note": "Treatment, cure, binding, restoration, or repair." },
    { "id": "birth_generation", "label": "birth / generation", "scope_note": "Conception, birth, parentage, descent, reproduction, and renewal." },
    { "id": "family_inheritance", "label": "family / inheritance", "scope_note": "Fathers, children, ancestors, legacy, bequest, descent, and posterity." },
    { "id": "architecture_building", "label": "architecture / building", "scope_note": "Edifices, foundations, pillars, temples, construction, collapse, and repair." },
    { "id": "law_contract", "label": "law / contract", "scope_note": "Oath, obligation, compact, title, right, law, judgment, and covenant-like binding." },
    { "id": "debt_accounting", "label": "debt / accounting", "scope_note": "Payment, repayment, balance, account, obligation, and exchange." },
    { "id": "religion_providence", "label": "religion / Providence", "scope_note": "God, judgment, offense, providence, sacred duty, consecration, and hallowing." },
    { "id": "sacrifice", "label": "sacrifice", "scope_note": "Offering, martyrdom, blood, death made meaningful, and loss converted into obligation." },
    { "id": "journey_motion", "label": "journey / motion", "scope_note": "Path, progress, course, advance, retreat, passing, and direction." },
    { "id": "experiment_science", "label": "experiment / science", "scope_note": "Testing, trial, proof, demonstration, and uncertain political experiment." },
    { "id": "agriculture", "label": "agriculture", "scope_note": "Harvest, soil, cultivation, seed, crop, field, and growth." },
    { "id": "mechanics", "label": "mechanics", "scope_note": "Force, machinery, operation, instrument, and mechanism." },
    { "id": "war_combat", "label": "war / combat", "scope_note": "Battle, arms, field, enemy, defense, defeat, and military action." },
    { "id": "light_darkness", "label": "light / darkness", "scope_note": "Illumination, obscurity, blindness, and revelation." },
    { "id": "slavery_bondage", "label": "slavery / bondage", "scope_note": "Bondage, enslavement, mastery, servitude, emancipation, and captivity." },
    { "id": "nature_organism", "label": "nature / organism", "scope_note": "Growth, decay, roots, branches, storms, climate, and organic life." }
  ],
  "target_domains": [
    { "id": "nation", "label": "nation" },
    { "id": "union", "label": "Union" },
    { "id": "constitution", "label": "Constitution" },
    { "id": "republic", "label": "republic" },
    { "id": "democracy", "label": "democracy" },
    { "id": "freedom", "label": "freedom" },
    { "id": "slavery", "label": "slavery" },
    { "id": "civil_war", "label": "Civil War" },
    { "id": "emancipation", "label": "emancipation" },
    { "id": "sacrifice", "label": "sacrifice" },
    { "id": "founding", "label": "founding" },
    { "id": "providence", "label": "Providence" },
    { "id": "reconciliation", "label": "reconciliation" },
    { "id": "citizenship", "label": "citizenship" },
    { "id": "enemy", "label": "enemy" },
    { "id": "people", "label": "people" },
    { "id": "law", "label": "law" },
    { "id": "history", "label": "history" }
  ],
  "rhetorical_functions": [
    { "id": "exhortation", "label": "exhortation" },
    { "id": "warning", "label": "warning" },
    { "id": "accusation", "label": "accusation" },
    { "id": "justification", "label": "justification" },
    { "id": "consolation", "label": "consolation" },
    { "id": "mourning", "label": "mourning" },
    { "id": "consecration", "label": "consecration" },
    { "id": "reconciliation", "label": "reconciliation" },
    { "id": "legitimation", "label": "legitimation" },
    { "id": "instruction", "label": "instruction" },
    { "id": "memorialization", "label": "memorialization" },
    { "id": "condemnation", "label": "condemnation" },
    { "id": "prophecy", "label": "prophecy" },
    { "id": "national_self_definition", "label": "national self-definition" }
  ],
  "ideological_functions": [
    { "id": "sacralization", "label": "sacralization" },
    { "id": "obligation", "label": "obligation" },
    { "id": "sacrifice", "label": "sacrifice" },
    { "id": "guilt_distribution", "label": "guilt distribution" },
    { "id": "redemption", "label": "redemption" },
    { "id": "purification", "label": "purification" },
    { "id": "displacement", "label": "displacement" },
    { "id": "enemy_construction", "label": "enemy construction" },
    { "id": "collective_immortality", "label": "collective immortality" },
    { "id": "moral_accounting", "label": "moral accounting" },
    { "id": "agency_suppression", "label": "agency suppression" },
    { "id": "reconciliation", "label": "reconciliation" },
    { "id": "historical_destiny", "label": "historical destiny" },
    { "id": "providential_judgment", "label": "providential judgment" }
  ],
  "semantic_shift_risk_values": [
    { "id": "low", "label": "low", "scope_note": "Basic meaning is unlikely to differ materially from present usage for the intended annotation." },
    { "id": "medium", "label": "medium", "scope_note": "Period, legal, religious, or rhetorical context may affect basic meaning or entailments." },
    { "id": "high", "label": "high", "scope_note": "Term requires explicit period-source control before confident MIPVU or CMT use." }
  ],
  "claim_statuses": [
    { "id": "evidence", "label": "evidence" },
    { "id": "interpretation", "label": "interpretation" },
    { "id": "inference", "label": "inference" },
    { "id": "speculation", "label": "speculation" },
    { "id": "open_question", "label": "open question" }
  ],
  "support_dimensions": [
    { "id": "sacred_object", "label": "sacred object" },
    { "id": "sacrificial_body", "label": "sacrificial body" },
    { "id": "enemy_as_death", "label": "enemy as death" },
    { "id": "historical_enactment_alignment", "label": "historical enactment or alignment" }
  ]
}
